title,description,status,category
Learn a new programming language,Master Python and build 3 projects,in-progress,Learning
Exercise regularly,Go to the gym 3 times per week,not-started,Health
Read 24 books,Read 2 books per month throughout the year,not-started,Learning
Travel to 3 new countries,Visit Japan, Iceland, and New Zealand,not-started,Travel
Complete a marathon,Run a full marathon by end of year,not-started,Health
Learn to play guitar,Master 10 songs on acoustic guitar,in-progress,Hobbies
Write a blog,Start a tech blog and publish monthly posts,not-started,Writing
Meditate daily,10 minutes of meditation every morning,not-started,Wellness
